{
  "$schema": "./../component.schema.json",
  "name": "BModal",
  "description": "If you use a form, consider wrapping the modal with it.",
  "props": [
    {
      "name": "modelValue",
      "type": [
        "Boolean"
      ],
      "default": false
    },
    {
      "name": "width",
      "type": [
        "Number"
      ],
      "default": "600"
    },
    {
      "name": "closeButton",
      "type": [
        "Boolean"
      ],
      "default": true
    }
  ],
  "slots": [
    {
      "name": "title"
    },
    {
      "name": "default"
    },
    {
      "name": "footer"
    }
  ],
  "events": [
    {
      "name": "update:modelValue"
    }
  ]
}
