{
  "$schema": "./../component.schema.json",
  "name": "BUpload",
  "description": "Set the enctype of the parent form to `enctype=\"multipart/form-data\"`.",
  "props": [
    {
      "name": "id",
      "type": [
        "String"
      ],
      "example": "upload"
    },
    {
      "name": "text",
      "type": [
        "String"
      ],
      "example": "Upload files"
    },
    {
      "name": "accept",
      "description": "Accepted file formats e.g. `image/jpeg, image/jpg, image/png, image/webp`",
      "type": [
        "String"
      ],
      "example": "image/jpeg, image/jpg, image/png, image/webp"
    }
  ],
  "events": [
    {
      "name": "update:modelValue"
    }
  ]
}
